{
  "schema_version": "2.0",
  "receipt_id": "8ccaa4a4-569c-5573-be57-bc3efd1e88c2",
  "kie_run_id": "9af856e1-96de-4b6e-80ed-0baa0586590a",
  "source_ocr_run_id": "ff328473-9aeb-4ed7-9b51-bc5d1a964eca",
  "extractor": {
    "name": "deterministic-invoice-kie",
    "version": "2.0.4"
  },
  "configuration": {
    "name": "invoice-baseline",
    "version": "2.1.0"
  },
  "fields": {
    "invoice_template_number": {
      "raw_text": "Mẫu số: 1",
      "predicted_value": "1",
      "normalized_value": "1",
      "normalization": {
        "rule": "identity_string",
        "version": "normalization-v0.1"
      },
      "value_status": "PRESENT",
      "confidence": null,
      "heuristic_score": 0.95,
      "score_version": "invoice-heuristic-2.0.0",
      "machine_needs_review": false,
      "review_reasons": [],
      "review_policy_version": "invoice-review-2.0.0",
      "source_block_ids": [
        "p0_b000002"
      ]
    },
    "invoice_symbol": {
      "raw_text": "Ký hiệu: C26T1A",
      "predicted_value": "C26T1A",
      "normalized_value": "C26T1A",
      "normalization": {
        "rule": "identity_string",
        "version": "normalization-v0.1"
      },
      "value_status": "PRESENT",
      "confidence": null,
      "heuristic_score": 0.95,
      "score_version": "invoice-heuristic-2.0.0",
      "machine_needs_review": false,
      "review_reasons": [],
      "review_policy_version": "invoice-review-2.0.0",
      "source_block_ids": [
        "p0_b000004"
      ]
    },
    "invoice_number": {
      "raw_text": "Số hóa đơn: 00000001\nSổ tay văn phòng",
      "predicted_value": "00000001",
      "normalized_value": null,
      "normalization": null,
      "value_status": "AMBIGUOUS",
      "confidence": null,
      "heuristic_score": 0.95,
      "score_version": "invoice-heuristic-2.0.0",
      "machine_needs_review": true,
      "review_reasons": [
        "MULTIPLE_CANDIDATES"
      ],
      "review_policy_version": "invoice-review-2.0.0",
      "source_block_ids": [
        "p0_b000006",
        "p0_b000030"
      ]
    },
    "invoice_date": {
      "raw_text": "Ngày lập: 2026-01-01",
      "predicted_value": "2026-01-01",
      "normalized_value": "2026-01-01",
      "normalization": {
        "rule": "iso_date",
        "version": "normalization-v0.1"
      },
      "value_status": "PRESENT",
      "confidence": null,
      "heuristic_score": 0.95,
      "score_version": "invoice-heuristic-2.0.0",
      "machine_needs_review": false,
      "review_reasons": [],
      "review_policy_version": "invoice-review-2.0.0",
      "source_block_ids": [
        "p0_b000008"
      ]
    },
    "seller_name": {
      "raw_text": "Đơn vị bán hàng: CỬA HÀNG MẪU SAO VIỆT",
      "predicted_value": "CỬA HÀNG MẪU SAO VIỆT",
      "normalized_value": "CỬA HÀNG MẪU SAO VIỆT",
      "normalization": {
        "rule": "identity_string",
        "version": "normalization-v0.1"
      },
      "value_status": "PRESENT",
      "confidence": null,
      "heuristic_score": 0.95,
      "score_version": "invoice-heuristic-2.0.0",
      "machine_needs_review": false,
      "review_reasons": [],
      "review_policy_version": "invoice-review-2.0.0",
      "source_block_ids": [
        "p0_b000001"
      ]
    },
    "seller_tax_id": {
      "raw_text": "MST người bán: 0000000001",
      "predicted_value": "0000000001",
      "normalized_value": "0000000001",
      "normalization": {
        "rule": "tax_id_printed_separators",
        "version": "invoice-normalization-2.0.0"
      },
      "value_status": "PRESENT",
      "confidence": null,
      "heuristic_score": 0.95,
      "score_version": "invoice-heuristic-2.0.0",
      "machine_needs_review": false,
      "review_reasons": [],
      "review_policy_version": "invoice-review-2.0.0",
      "source_block_ids": [
        "p0_b000003"
      ]
    },
    "seller_address": {
      "raw_text": "Địa chỉ người bán: 1 Đường Mẫu, Thành phố Hà Nội",
      "predicted_value": "1 Đường Mẫu, Thành phố Hà Nội",
      "normalized_value": "1 Đường Mẫu, Thành phố Hà Nội",
      "normalization": {
        "rule": "identity_string",
        "version": "normalization-v0.1"
      },
      "value_status": "PRESENT",
      "confidence": null,
      "heuristic_score": 0.95,
      "score_version": "invoice-heuristic-2.0.0",
      "machine_needs_review": false,
      "review_reasons": [],
      "review_policy_version": "invoice-review-2.0.0",
      "source_block_ids": [
        "p0_b000005"
      ]
    },
    "buyer_name": {
      "raw_text": "Người mua: KHÁCH HÀNG THỬ NGHIỆM",
      "predicted_value": "KHÁCH HÀNG THỬ NGHIỆM",
      "normalized_value": "KHÁCH HÀNG THỬ NGHIỆM",
      "normalization": {
        "rule": "identity_string",
        "version": "normalization-v0.1"
      },
      "value_status": "PRESENT",
      "confidence": null,
      "heuristic_score": 0.95,
      "score_version": "invoice-heuristic-2.0.0",
      "machine_needs_review": false,
      "review_reasons": [],
      "review_policy_version": "invoice-review-2.0.0",
      "source_block_ids": [
        "p0_b000007"
      ]
    },
    "buyer_tax_id": {
      "raw_text": "MST người mua: 0000003001",
      "predicted_value": "0000003001",
      "normalized_value": "0000003001",
      "normalization": {
        "rule": "tax_id_printed_separators",
        "version": "invoice-normalization-2.0.0"
      },
      "value_status": "PRESENT",
      "confidence": null,
      "heuristic_score": 0.95,
      "score_version": "invoice-heuristic-2.0.0",
      "machine_needs_review": false,
      "review_reasons": [],
      "review_policy_version": "invoice-review-2.0.0",
      "source_block_ids": [
        "p0_b000009"
      ]
    },
    "subtotal": {
      "raw_text": "Cộng tiền hàng: 884.000",
      "predicted_value": "884.000",
      "normalized_value": 884000,
      "normalization": {
        "rule": "vnd_grouped_integer",
        "version": "normalization-v0.1"
      },
      "value_status": "PRESENT",
      "confidence": null,
      "heuristic_score": 0.95,
      "score_version": "invoice-heuristic-2.0.0",
      "machine_needs_review": false,
      "review_reasons": [],
      "review_policy_version": "invoice-review-2.0.0",
      "source_block_ids": [
        "p0_b000041"
      ]
    },
    "tax_amount": {
      "raw_text": "Tiền thuế GTGT: 0",
      "predicted_value": "0",
      "normalized_value": 0,
      "normalization": {
        "rule": "vnd_plain_integer",
        "version": "normalization-v0.1"
      },
      "value_status": "PRESENT",
      "confidence": null,
      "heuristic_score": 0.95,
      "score_version": "invoice-heuristic-2.0.0",
      "machine_needs_review": false,
      "review_reasons": [],
      "review_policy_version": "invoice-review-2.0.0",
      "source_block_ids": [
        "p0_b000042"
      ]
    },
    "total_amount": {
      "raw_text": "Tổng thanh toán: 884.000",
      "predicted_value": "884.000",
      "normalized_value": 884000,
      "normalization": {
        "rule": "vnd_grouped_integer",
        "version": "normalization-v0.1"
      },
      "value_status": "PRESENT",
      "confidence": null,
      "heuristic_score": 0.95,
      "score_version": "invoice-heuristic-2.0.0",
      "machine_needs_review": false,
      "review_reasons": [],
      "review_policy_version": "invoice-review-2.0.0",
      "source_block_ids": [
        "p0_b000043"
      ]
    },
    "currency": {
      "raw_text": "Tiền tệ: VND",
      "predicted_value": "VND",
      "normalized_value": "VND",
      "normalization": {
        "rule": "explicit_vnd_marker",
        "version": "invoice-normalization-2.0.0"
      },
      "value_status": "PRESENT",
      "confidence": null,
      "heuristic_score": 0.95,
      "score_version": "invoice-heuristic-2.0.0",
      "machine_needs_review": false,
      "review_reasons": [],
      "review_policy_version": "invoice-review-2.0.0",
      "source_block_ids": [
        "p0_b000044"
      ]
    }
  },
  "line_items": [],
  "tax_breakdown": [
    {
      "rate": {
        "raw_text": "Thuế suất GTGT: 0%",
        "predicted_value": "0%",
        "normalized_value": "0%",
        "normalization": {
          "rule": "printed_percent",
          "version": "invoice-normalization-2.0.0"
        },
        "value_status": "PRESENT",
        "confidence": null,
        "heuristic_score": 0.95,
        "score_version": "invoice-heuristic-2.0.0",
        "machine_needs_review": false,
        "review_reasons": [],
        "review_policy_version": "invoice-review-2.0.0",
        "source_block_ids": [
          "p0_b000040"
        ]
      },
      "taxable_amount": {
        "raw_text": null,
        "predicted_value": null,
        "normalized_value": null,
        "normalization": null,
        "value_status": "UNKNOWN",
        "confidence": null,
        "heuristic_score": 0.0,
        "score_version": "invoice-heuristic-2.0.0",
        "machine_needs_review": true,
        "review_reasons": [
          "NO_CANDIDATE"
        ],
        "review_policy_version": "invoice-review-2.0.0",
        "source_block_ids": []
      },
      "tax_amount": {
        "raw_text": null,
        "predicted_value": null,
        "normalized_value": null,
        "normalization": null,
        "value_status": "UNKNOWN",
        "confidence": null,
        "heuristic_score": 0.0,
        "score_version": "invoice-heuristic-2.0.0",
        "machine_needs_review": true,
        "review_reasons": [
          "NO_CANDIDATE"
        ],
        "review_policy_version": "invoice-review-2.0.0",
        "source_block_ids": []
      }
    }
  ],
  "consistency": {
    "version": "invoice-consistency-2.0.0",
    "tolerance_vnd": 1,
    "checks": [
      {
        "name": "line_sum_subtotal",
        "status": "SKIPPED",
        "difference_vnd": null
      },
      {
        "name": "subtotal_tax_total",
        "status": "PASS",
        "difference_vnd": 0
      }
    ]
  }
}
